{
  "id": "be-be",
  "forms": [
    {
      "lang": "gba",
      "script": "be",
      "gloss": "sein"
    },
    {
      "lang": "eng",
      "script": "be",
      "gloss": "sein"
    }
  ],
  "contributor": "kfm",
  "added": "2026-07-12",
  "sources": [
    "Lyle Campbell, Historical Linguistics: An Introduction, 3rd edition, p. 350"
  ]
}
