{
  "id": "qindil-kindle",
  "forms": [
    {
      "lang": "ara",
      "script": "قنديل",
      "translit": "qindīl",
      "gloss": "Kandelaber, Öllampe"
    },
    {
      "lang": "eng",
      "script": "kindle",
      "gloss": "entzünden"
    }
  ],
  "contributor": "kfm",
  "added": "2026-06-20"
}
