{
  "id": "ga-ga",
  "forms": [
    {
      "lang": "ara",
      "dialect": "Baghdad (muslim.)",
      "script": "قاع",
      "translit": "gāʕ",
      "gloss": "Boden"
    },
    {
      "lang": "grc",
      "dialect": "Dorisch",
      "script": "γᾶ",
      "translit": "gã",
      "gloss": "Erde"
    }
  ],
  "contributor": "kfm",
  "added": "2026-06-20"
}
