{
  "id": "sruti-sirat",
  "forms": [
    {
      "lang": "san",
      "script": "सृति",
      "translit": "sṛti-",
      "gloss": "Weg"
    },
    {
      "lang": "ara",
      "script": "صراط",
      "translit": "ṣirāṭ",
      "gloss": "Weg"
    }
  ],
  "contributor": "kfm",
  "added": "2026-06-20"
}
