{
  "id": "radii-radu",
  "forms": [
    {
      "lang": "ara",
      "script": "راضي",
      "translit": "rāḍī",
      "gloss": "zufrieden"
    },
    {
      "lang": "chu",
      "script": "радъ",
      "translit": "radŭ",
      "gloss": "zufrieden"
    }
  ],
  "contributor": "kfm",
  "added": "2026-06-20"
}
