{
  "id": "sumtak-syntax",
  "forms": [
    {
      "lang": "bod",
      "script": "སུམ་རྟགས",
      "translit": "sum.tak",
      "gloss": "Grammatik (wörtlich: drei Zeichen)"
    },
    {
      "lang": "deu",
      "script": "Syntax"
    }
  ],
  "contributor": "kfm",
  "added": "2026-06-20",
  "sources": [
    "https://tibetanlanguage.school/resources/traditional-grammar/the-sumtak/"
  ]
}
