{
  "id": "ragil-regular",
  "forms": [
    {
      "lang": "heb",
      "script": "רָגִיל",
      "translit": "rāgīl",
      "gloss": "normal, gewöhnlich"
    },
    {
      "lang": "eng",
      "script": "regular",
      "gloss": "regelmäßig"
    }
  ],
  "contributor": "kfm",
  "added": "2026-06-20"
}
