{
  "id": "yodea-oida",
  "forms": [
    {
      "lang": "heb",
      "script": "יודע",
      "translit": "yodeaʿ",
      "gloss": "wissend"
    },
    {
      "lang": "grc",
      "script": "οἶδα",
      "translit": "oida",
      "gloss": "ich weiß"
    }
  ],
  "contributor": "kfm",
  "added": "2026-06-20"
}
