{
  "id": "bayat-bayan",
  "forms": [
    {
      "lang": "rus",
      "script": "баять",
      "translit": "bajat'",
      "gloss": "sprechen, erzählen"
    },
    {
      "lang": "ara",
      "script": "بيان",
      "translit": "bayān",
      "gloss": "Erklärung, Rede"
    }
  ],
  "contributor": "kfm",
  "added": "2026-06-20"
}
