{
  "id": "kapala-kephale",
  "forms": [
    {
      "lang": "san",
      "script": "कपाल",
      "translit": "kapāla",
      "gloss": "Schädel"
    },
    {
      "lang": "grc",
      "script": "κεφαλή",
      "translit": "kephalḗ",
      "gloss": "Kopf"
    }
  ],
  "contributor": "kfm",
  "added": "2026-06-20"
}
