{
  "id": "brat-brat",
  "forms": [
    {
      "lang": "ara",
      "dialect": "Rijāl Almaʿ",
      "script": "برت",
      "translit": "brat",
      "gloss": "Mädchen"
    },
    {
      "lang": "eng",
      "script": "brat",
      "gloss": "Göre, freches Kind"
    }
  ],
  "contributor": "kfm",
  "added": "2026-06-20"
}
