{
  "id": "mangala-mangal",
  "forms": [
    {
      "lang": "san",
      "script": "मङ्गल",
      "translit": "maṅgala",
      "gloss": "Planet Mars"
    },
    {
      "lang": "tur",
      "script": "mangal",
      "gloss": "Grill"
    }
  ],
  "comment": "Zwei unabhängige Wege zum gleichen Lautbild: das indische *maṅgala* führte über das Sindhi und Kholosi zum Wort für 'Feuer'. Das türkische *mangal* dagegen geht über das arabische منقل (*minqal*, von der Wurzel NQL 'tragen') zurück und bezeichnete ursprünglich ein tragbares Kohlebecken. Beide Etymologien begegnen sich erst im modernen rumänischen *mangal* 'Kohle'.",
  "contributor": "kfm",
  "added": "2026-06-20",
  "sources": [
    "https://en.wikipedia.org/wiki/Mangala",
    "https://en.wikipedia.org/wiki/Mangal_(barbecue)"
  ]
}
