{
  "id": "end-ind-and",
  "forms": [
    {
      "lang": "hye",
      "script": "ընդ",
      "translit": "ənd",
      "gloss": "mit"
    },
    {
      "lang": "ara",
      "script": "عَند",
      "translit": "ʿinda",
      "gloss": "bei"
    },
    {
      "lang": "eng",
      "script": "and"
    }
  ],
  "contributor": "kfm",
  "added": "2026-06-20"
}
