{
  "id": "stam-stamm",
  "forms": [
    {
      "lang": "txb",
      "translit": "stām",
      "gloss": "Baum"
    },
    {
      "lang": "xto",
      "translit": "ṣtām",
      "gloss": "Baum"
    },
    {
      "lang": "deu",
      "script": "Stamm"
    }
  ],
  "contributor": "kfm",
  "added": "2026-06-20"
}
