{
  "id": "bekar-beggar-bhikhari",
  "forms": [
    {
      "lang": "tur",
      "script": "bekar",
      "gloss": "ohne Arbeit, ledig"
    },
    {
      "lang": "eng",
      "script": "beggar",
      "gloss": "Bettler"
    },
    {
      "lang": "hin",
      "script": "भिखारी",
      "translit": "bhikhārī",
      "gloss": "Bettler"
    }
  ],
  "contributor": "ap",
  "added": "2026-06-20"
}
