{
  "id": "auo-au",
  "forms": [
    {
      "lang": "cop",
      "script": "ⲁⲩⲱ",
      "translit": "auō",
      "gloss": "und"
    },
    {
      "lang": "hin",
      "dialect": "Chattisgarhi",
      "script": "अऊ",
      "translit": "au",
      "gloss": "und"
    }
  ],
  "contributor": "kfm",
  "added": "2026-06-20"
}
